{
  "schemaVersion": 1,
  "season": "2026/27",
  "clubId": "crawley-town",
  "snapshot": "2026-09-15",
  "sourceSummary": "Crawley Town current 2026/27 first-team roster, shirt number, nationality and broad playing role from FootballSquads after the summer window. The selected 16 use a balanced mix of 2 goalkeepers, 5 defenders, 5 midfielders and 4 forwards.",
  "players": [
    {
      "footballName": "Vito Mannone",
      "group": "Goalkeeper",
      "nationality": "Italy",
      "shirt": 1,
      "source": "https://www.footballsquads.co.uk/eng/2026-2027/fltwo/crawley.htm · current 2026/27 roster · #1 · Goalkeeper"
    },
    {
      "footballName": "Nicholas Michalski",
      "group": "Goalkeeper",
      "nationality": "England",
      "shirt": 13,
      "source": "https://www.footballsquads.co.uk/eng/2026-2027/fltwo/crawley.htm · current 2026/27 roster · #13 · Goalkeeper"
    },
    {
      "footballName": "Kellan Gordon",
      "group": "Defender",
      "nationality": "England",
      "shirt": 2,
      "source": "https://www.footballsquads.co.uk/eng/2026-2027/fltwo/crawley.htm · current 2026/27 roster · #2 · Defender"
    },
    {
      "footballName": "Pele Arganese-McDermott",
      "group": "Defender",
      "nationality": "Spain",
      "shirt": 4,
      "source": "https://www.footballsquads.co.uk/eng/2026-2027/fltwo/crawley.htm · current 2026/27 roster · #4 · Defender"
    },
    {
      "footballName": "Charlie Barker",
      "group": "Defender",
      "nationality": "England",
      "shirt": 5,
      "source": "https://www.footballsquads.co.uk/eng/2026-2027/fltwo/crawley.htm · current 2026/27 roster · #5 · Defender"
    },
    {
      "footballName": "Priestley Farquharson",
      "group": "Defender",
      "nationality": "England",
      "shirt": 6,
      "source": "https://www.footballsquads.co.uk/eng/2026-2027/fltwo/crawley.htm · current 2026/27 roster · #6 · Defender"
    },
    {
      "footballName": "Lewis Richards",
      "group": "Defender",
      "nationality": "Republic of Ireland",
      "shirt": 12,
      "source": "https://www.footballsquads.co.uk/eng/2026-2027/fltwo/crawley.htm · current 2026/27 roster · #12 · Defender"
    },
    {
      "footballName": "Louie Watson",
      "group": "Midfielder",
      "nationality": "Republic of Ireland",
      "shirt": 8,
      "source": "https://www.footballsquads.co.uk/eng/2026-2027/fltwo/crawley.htm · current 2026/27 roster · #8 · Midfielder"
    },
    {
      "footballName": "Stephen Duke-McKenna",
      "group": "Midfielder",
      "nationality": "Guyana",
      "shirt": 10,
      "source": "https://www.footballsquads.co.uk/eng/2026-2027/fltwo/crawley.htm · current 2026/27 roster · #10 · Midfielder"
    },
    {
      "footballName": "Dion Pereira",
      "group": "Midfielder",
      "nationality": "Antigua and Barbuda",
      "shirt": 19,
      "source": "https://www.footballsquads.co.uk/eng/2026-2027/fltwo/crawley.htm · current 2026/27 roster · #19 · Midfielder"
    },
    {
      "footballName": "Jude Arthurs",
      "group": "Midfielder",
      "nationality": "England",
      "shirt": 20,
      "source": "https://www.footballsquads.co.uk/eng/2026-2027/fltwo/crawley.htm · current 2026/27 roster · #20 · Midfielder"
    },
    {
      "footballName": "Justin Ferizaj",
      "group": "Midfielder",
      "nationality": "Republic of Ireland",
      "shirt": 21,
      "source": "https://www.footballsquads.co.uk/eng/2026-2027/fltwo/crawley.htm · current 2026/27 roster · #21 · Midfielder"
    },
    {
      "footballName": "Malcolm Ebiowei",
      "group": "Forward",
      "nationality": "England",
      "shirt": 7,
      "source": "https://www.footballsquads.co.uk/eng/2026-2027/fltwo/crawley.htm · current 2026/27 roster · #7 · Forward"
    },
    {
      "footballName": "Danilo Orsi-Dadomo",
      "group": "Forward",
      "nationality": "England",
      "shirt": 9,
      "source": "https://www.footballsquads.co.uk/eng/2026-2027/fltwo/crawley.htm · current 2026/27 roster · #9 · Forward"
    },
    {
      "footballName": "Pemi Aderoju",
      "group": "Forward",
      "nationality": "England",
      "shirt": 11,
      "source": "https://www.footballsquads.co.uk/eng/2026-2027/fltwo/crawley.htm · current 2026/27 roster · #11 · Forward"
    },
    {
      "footballName": "Gianmarco Di Biase",
      "group": "Forward",
      "nationality": "Italy",
      "shirt": 14,
      "source": "https://www.footballsquads.co.uk/eng/2026-2027/fltwo/crawley.htm · current 2026/27 roster · #14 · Forward"
    }
  ]
}
