{
  "schemaVersion": 1,
  "season": "2026/27",
  "clubId": "york-city",
  "snapshot": "2026-09-15",
  "sourceSummary": "York City current 2026/27 first-team roster, shirt number, nationality and broad playing role from FootballSquads after the summer window. The selected 16 use a balanced mix of 2 goalkeepers, 5 defenders, 5 midfielders and 4 forwards.",
  "players": [
    {
      "footballName": "Alfie McNally",
      "group": "Goalkeeper",
      "nationality": "England",
      "shirt": 1,
      "source": "https://www.footballsquads.co.uk/eng/2026-2027/fltwo/york.htm · current 2026/27 roster · #1 · Goalkeeper"
    },
    {
      "footballName": "George Sykes-Kenworthy",
      "group": "Goalkeeper",
      "nationality": "England",
      "shirt": 31,
      "source": "https://www.footballsquads.co.uk/eng/2026-2027/fltwo/york.htm · current 2026/27 roster · #31 · Goalkeeper"
    },
    {
      "footballName": "Ryan Fallowfield",
      "group": "Defender",
      "nationality": "England",
      "shirt": 2,
      "source": "https://www.footballsquads.co.uk/eng/2026-2027/fltwo/york.htm · current 2026/27 roster · #2 · Defender"
    },
    {
      "footballName": "Mark Kitching",
      "group": "Defender",
      "nationality": "England",
      "shirt": 3,
      "source": "https://www.footballsquads.co.uk/eng/2026-2027/fltwo/york.htm · current 2026/27 roster · #3 · Defender"
    },
    {
      "footballName": "Zech Medley",
      "group": "Defender",
      "nationality": "England",
      "shirt": 4,
      "source": "https://www.footballsquads.co.uk/eng/2026-2027/fltwo/york.htm · current 2026/27 roster · #4 · Defender"
    },
    {
      "footballName": "Zak Johnson",
      "group": "Defender",
      "nationality": "England",
      "shirt": 5,
      "source": "https://www.footballsquads.co.uk/eng/2026-2027/fltwo/york.htm · current 2026/27 roster · #5 · Defender"
    },
    {
      "footballName": "Ashley Palmer",
      "group": "Defender",
      "nationality": "England",
      "shirt": 6,
      "source": "https://www.footballsquads.co.uk/eng/2026-2027/fltwo/york.htm · current 2026/27 roster · #6 · Defender"
    },
    {
      "footballName": "Alex Hunt",
      "group": "Midfielder",
      "nationality": "Republic of Ireland",
      "shirt": 8,
      "source": "https://www.footballsquads.co.uk/eng/2026-2027/fltwo/york.htm · current 2026/27 roster · #8 · Midfielder"
    },
    {
      "footballName": "Frankie Maguire",
      "group": "Midfielder",
      "nationality": "England",
      "shirt": 11,
      "source": "https://www.footballsquads.co.uk/eng/2026-2027/fltwo/york.htm · current 2026/27 roster · #11 · Midfielder"
    },
    {
      "footballName": "Arthur Read",
      "group": "Midfielder",
      "nationality": "England",
      "shirt": 16,
      "source": "https://www.footballsquads.co.uk/eng/2026-2027/fltwo/york.htm · current 2026/27 roster · #16 · Midfielder"
    },
    {
      "footballName": "Craig Hewitt",
      "group": "Midfielder",
      "nationality": "England",
      "shirt": 17,
      "source": "https://www.footballsquads.co.uk/eng/2026-2027/fltwo/york.htm · current 2026/27 roster · #17 · Midfielder"
    },
    {
      "footballName": "Hiram Boateng",
      "group": "Midfielder",
      "nationality": "England",
      "shirt": 21,
      "source": "https://www.footballsquads.co.uk/eng/2026-2027/fltwo/york.htm · current 2026/27 roster · #21 · Midfielder"
    },
    {
      "footballName": "Joe Grey",
      "group": "Forward",
      "nationality": "England",
      "shirt": 7,
      "source": "https://www.footballsquads.co.uk/eng/2026-2027/fltwo/york.htm · current 2026/27 roster · #7 · Forward"
    },
    {
      "footballName": "Josh Stones",
      "group": "Forward",
      "nationality": "England",
      "shirt": 9,
      "source": "https://www.footballsquads.co.uk/eng/2026-2027/fltwo/york.htm · current 2026/27 roster · #9 · Forward"
    },
    {
      "footballName": "Ollie Pearce",
      "group": "Forward",
      "nationality": "England",
      "shirt": 10,
      "source": "https://www.footballsquads.co.uk/eng/2026-2027/fltwo/york.htm · current 2026/27 roster · #10 · Forward"
    },
    {
      "footballName": "Jovan Malcolm",
      "group": "Forward",
      "nationality": "England",
      "shirt": 18,
      "source": "https://www.footballsquads.co.uk/eng/2026-2027/fltwo/york.htm · current 2026/27 roster · #18 · Forward"
    }
  ]
}
