{
  "schemaVersion": 1,
  "season": "2026/27",
  "clubId": "swindon-town",
  "snapshot": "2026-09-15",
  "sourceSummary": "Swindon Town current 2026/27 first-team roster, shirt number, nationality and broad playing role from FootballSquads after the summer window. The selected 16 use a balanced mix of 2 goalkeepers, 5 defenders, 5 midfielders and 4 forwards.",
  "players": [
    {
      "footballName": "Connor Ripley",
      "group": "Goalkeeper",
      "nationality": "England",
      "shirt": 1,
      "source": "https://www.footballsquads.co.uk/eng/2026-2027/fltwo/swindon.htm · current 2026/27 roster · #1 · Goalkeeper"
    },
    {
      "footballName": "Lewis Ward",
      "group": "Goalkeeper",
      "nationality": "England",
      "shirt": 12,
      "source": "https://www.footballsquads.co.uk/eng/2026-2027/fltwo/swindon.htm · current 2026/27 roster · #12 · Goalkeeper"
    },
    {
      "footballName": "Mitchell Clark",
      "group": "Defender",
      "nationality": "Wales",
      "shirt": 2,
      "source": "https://www.footballsquads.co.uk/eng/2026-2027/fltwo/swindon.htm · current 2026/27 roster · #2 · Defender"
    },
    {
      "footballName": "Stephan Negru",
      "group": "Defender",
      "nationality": "Moldova",
      "shirt": 5,
      "source": "https://www.footballsquads.co.uk/eng/2026-2027/fltwo/swindon.htm · current 2026/27 roster · #5 · Defender"
    },
    {
      "footballName": "Sam Inwood",
      "group": "Defender",
      "nationality": "Northern Ireland",
      "shirt": 16,
      "source": "https://www.footballsquads.co.uk/eng/2026-2027/fltwo/swindon.htm · current 2026/27 roster · #16 · Defender"
    },
    {
      "footballName": "Ryan Tafazolli",
      "group": "Defender",
      "nationality": "England",
      "shirt": 17,
      "source": "https://www.footballsquads.co.uk/eng/2026-2027/fltwo/swindon.htm · current 2026/27 roster · #17 · Defender"
    },
    {
      "footballName": "James Debayo",
      "group": "Defender",
      "nationality": "England",
      "shirt": 18,
      "source": "https://www.footballsquads.co.uk/eng/2026-2027/fltwo/swindon.htm · current 2026/27 roster · #18 · Defender"
    },
    {
      "footballName": "Gavin Kilkenny",
      "group": "Midfielder",
      "nationality": "Republic of Ireland",
      "shirt": 4,
      "source": "https://www.footballsquads.co.uk/eng/2026-2027/fltwo/swindon.htm · current 2026/27 roster · #4 · Midfielder"
    },
    {
      "footballName": "James Ball",
      "group": "Midfielder",
      "nationality": "England",
      "shirt": 6,
      "source": "https://www.footballsquads.co.uk/eng/2026-2027/fltwo/swindon.htm · current 2026/27 roster · #6 · Midfielder"
    },
    {
      "footballName": "Ollie Clarke",
      "group": "Midfielder",
      "nationality": "England",
      "shirt": 8,
      "source": "https://www.footballsquads.co.uk/eng/2026-2027/fltwo/swindon.htm · current 2026/27 roster · #8 · Midfielder"
    },
    {
      "footballName": "Joseph Hungbo",
      "group": "Midfielder",
      "nationality": "England",
      "shirt": 15,
      "source": "https://www.footballsquads.co.uk/eng/2026-2027/fltwo/swindon.htm · current 2026/27 roster · #15 · Midfielder"
    },
    {
      "footballName": "Joe Snowdon",
      "group": "Midfielder",
      "nationality": "England",
      "shirt": 19,
      "source": "https://www.footballsquads.co.uk/eng/2026-2027/fltwo/swindon.htm · current 2026/27 roster · #19 · Midfielder"
    },
    {
      "footballName": "Tom Nichols",
      "group": "Forward",
      "nationality": "England",
      "shirt": 7,
      "source": "https://www.footballsquads.co.uk/eng/2026-2027/fltwo/swindon.htm · current 2026/27 roster · #7 · Forward"
    },
    {
      "footballName": "Paul Glatzel",
      "group": "Forward",
      "nationality": "Germany",
      "shirt": 9,
      "source": "https://www.footballsquads.co.uk/eng/2026-2027/fltwo/swindon.htm · current 2026/27 roster · #9 · Forward"
    },
    {
      "footballName": "Harry Smith",
      "group": "Forward",
      "nationality": "England",
      "shirt": 10,
      "source": "https://www.footballsquads.co.uk/eng/2026-2027/fltwo/swindon.htm · current 2026/27 roster · #10 · Forward"
    },
    {
      "footballName": "Fletcher Holman",
      "group": "Forward",
      "nationality": "England",
      "shirt": 11,
      "source": "https://www.footballsquads.co.uk/eng/2026-2027/fltwo/swindon.htm · current 2026/27 roster · #11 · Forward"
    }
  ]
}
