{
  "schemaVersion": 1,
  "season": "2026/27",
  "clubId": "grimsby-town",
  "snapshot": "2026-09-15",
  "sourceSummary": "Grimsby Town current 2026/27 first-team roster, shirt number, nationality and broad playing role from FootballSquads after the summer window. The selected 16 use a balanced mix of 2 goalkeepers, 5 defenders, 5 midfielders and 4 forwards.",
  "players": [
    {
      "footballName": "Harvey Cartwright",
      "group": "Goalkeeper",
      "nationality": "England",
      "shirt": 1,
      "source": "https://www.footballsquads.co.uk/eng/2026-2027/fltwo/grimsby.htm · current 2026/27 roster · #1 · Goalkeeper"
    },
    {
      "footballName": "Christy Pym",
      "group": "Goalkeeper",
      "nationality": "England",
      "shirt": 31,
      "source": "https://www.footballsquads.co.uk/eng/2026-2027/fltwo/grimsby.htm · current 2026/27 roster · #31 · Goalkeeper"
    },
    {
      "footballName": "Maldini Kacurri",
      "group": "Defender",
      "nationality": "Albania",
      "shirt": 2,
      "source": "https://www.footballsquads.co.uk/eng/2026-2027/fltwo/grimsby.htm · current 2026/27 roster · #2 · Defender"
    },
    {
      "footballName": "Jayden Sweeney",
      "group": "Defender",
      "nationality": "England",
      "shirt": 3,
      "source": "https://www.footballsquads.co.uk/eng/2026-2027/fltwo/grimsby.htm · current 2026/27 roster · #3 · Defender"
    },
    {
      "footballName": "Harvey Rodgers",
      "group": "Defender",
      "nationality": "England",
      "shirt": 5,
      "source": "https://www.footballsquads.co.uk/eng/2026-2027/fltwo/grimsby.htm · current 2026/27 roster · #5 · Defender"
    },
    {
      "footballName": "Sam Lavelle",
      "group": "Defender",
      "nationality": "Scotland",
      "shirt": 6,
      "source": "https://www.footballsquads.co.uk/eng/2026-2027/fltwo/grimsby.htm · current 2026/27 roster · #6 · Defender"
    },
    {
      "footballName": "Joe Foulkes",
      "group": "Defender",
      "nationality": "England",
      "shirt": 12,
      "source": "https://www.footballsquads.co.uk/eng/2026-2027/fltwo/grimsby.htm · current 2026/27 roster · #12 · Defender"
    },
    {
      "footballName": "Kieran Green",
      "group": "Midfielder",
      "nationality": "England",
      "shirt": 4,
      "source": "https://www.footballsquads.co.uk/eng/2026-2027/fltwo/grimsby.htm · current 2026/27 roster · #4 · Midfielder"
    },
    {
      "footballName": "Jamie Walker",
      "group": "Midfielder",
      "nationality": "Scotland",
      "shirt": 7,
      "source": "https://www.footballsquads.co.uk/eng/2026-2027/fltwo/grimsby.htm · current 2026/27 roster · #7 · Midfielder"
    },
    {
      "footballName": "Cian Doyle",
      "group": "Midfielder",
      "nationality": "Republic of Ireland",
      "shirt": 8,
      "source": "https://www.footballsquads.co.uk/eng/2026-2027/fltwo/grimsby.htm · current 2026/27 roster · #8 · Midfielder"
    },
    {
      "footballName": "Ryley Reynolds",
      "group": "Midfielder",
      "nationality": "England",
      "shirt": 11,
      "source": "https://www.footballsquads.co.uk/eng/2026-2027/fltwo/grimsby.htm · current 2026/27 roster · #11 · Midfielder"
    },
    {
      "footballName": "Géza Dávid Turi",
      "group": "Midfielder",
      "nationality": "Faroe Islands",
      "shirt": 15,
      "source": "https://www.footballsquads.co.uk/eng/2026-2027/fltwo/grimsby.htm · current 2026/27 roster · #15 · Midfielder"
    },
    {
      "footballName": "Iwan Morgan",
      "group": "Forward",
      "nationality": "Wales",
      "shirt": 9,
      "source": "https://www.footballsquads.co.uk/eng/2026-2027/fltwo/grimsby.htm · current 2026/27 roster · #9 · Forward"
    },
    {
      "footballName": "Sonny Finch",
      "group": "Forward",
      "nationality": "England",
      "shirt": 10,
      "source": "https://www.footballsquads.co.uk/eng/2026-2027/fltwo/grimsby.htm · current 2026/27 roster · #10 · Forward"
    },
    {
      "footballName": "Justin Amaluzor",
      "group": "Forward",
      "nationality": "England",
      "shirt": 14,
      "source": "https://www.footballsquads.co.uk/eng/2026-2027/fltwo/grimsby.htm · current 2026/27 roster · #14 · Forward"
    },
    {
      "footballName": "Josh Andrews",
      "group": "Forward",
      "nationality": "England",
      "shirt": 19,
      "source": "https://www.footballsquads.co.uk/eng/2026-2027/fltwo/grimsby.htm · current 2026/27 roster · #19 · Forward"
    }
  ]
}
