{
  "schemaVersion": 1,
  "season": "2026/27",
  "clubId": "port-vale",
  "snapshot": "2026-09-15",
  "sourceSummary": "Port Vale current 2026/27 first-team roster, shirt number, nationality and broad playing role from FootballSquads after the summer window. The selected 16 use a balanced mix of 2 goalkeepers, 5 defenders, 5 midfielders and 4 forwards.",
  "players": [
    {
      "footballName": "Jackson Smith",
      "group": "Goalkeeper",
      "nationality": "England",
      "shirt": 1,
      "source": "https://www.footballsquads.co.uk/eng/2026-2027/fltwo/portv.htm · current 2026/27 roster · #1 · Goalkeeper"
    },
    {
      "footballName": "Mason Terry",
      "group": "Goalkeeper",
      "nationality": "England",
      "shirt": 13,
      "source": "https://www.footballsquads.co.uk/eng/2026-2027/fltwo/portv.htm · current 2026/27 roster · #13 · Goalkeeper"
    },
    {
      "footballName": "Kyle John",
      "group": "Defender",
      "nationality": "England",
      "shirt": 2,
      "source": "https://www.footballsquads.co.uk/eng/2026-2027/fltwo/portv.htm · current 2026/27 roster · #2 · Defender"
    },
    {
      "footballName": "Jaheim Headley",
      "group": "Defender",
      "nationality": "England",
      "shirt": 3,
      "source": "https://www.footballsquads.co.uk/eng/2026-2027/fltwo/portv.htm · current 2026/27 roster · #3 · Defender"
    },
    {
      "footballName": "Jasper Moon",
      "group": "Defender",
      "nationality": "England",
      "shirt": 4,
      "source": "https://www.footballsquads.co.uk/eng/2026-2027/fltwo/portv.htm · current 2026/27 roster · #4 · Defender"
    },
    {
      "footballName": "Connor Hall",
      "group": "Defender",
      "nationality": "England",
      "shirt": 5,
      "source": "https://www.footballsquads.co.uk/eng/2026-2027/fltwo/portv.htm · current 2026/27 roster · #5 · Defender"
    },
    {
      "footballName": "Jordan Lawrence-Gabriel",
      "group": "Defender",
      "nationality": "Scotland",
      "shirt": 6,
      "source": "https://www.footballsquads.co.uk/eng/2026-2027/fltwo/portv.htm · current 2026/27 roster · #6 · Defender"
    },
    {
      "footballName": "George Byers",
      "group": "Midfielder",
      "nationality": "Scotland",
      "shirt": 7,
      "source": "https://www.footballsquads.co.uk/eng/2026-2027/fltwo/portv.htm · current 2026/27 roster · #7 · Midfielder"
    },
    {
      "footballName": "Ben Garrity",
      "group": "Midfielder",
      "nationality": "England",
      "shirt": 8,
      "source": "https://www.footballsquads.co.uk/eng/2026-2027/fltwo/portv.htm · current 2026/27 roster · #8 · Midfielder"
    },
    {
      "footballName": "Kyle Dempsey",
      "group": "Midfielder",
      "nationality": "England",
      "shirt": 10,
      "source": "https://www.footballsquads.co.uk/eng/2026-2027/fltwo/portv.htm · current 2026/27 roster · #10 · Midfielder"
    },
    {
      "footballName": "Onel Hernández",
      "group": "Midfielder",
      "nationality": "Cuba",
      "shirt": 11,
      "source": "https://www.footballsquads.co.uk/eng/2026-2027/fltwo/portv.htm · current 2026/27 roster · #11 · Midfielder"
    },
    {
      "footballName": "Ryan Croasdale",
      "group": "Midfielder",
      "nationality": "England",
      "shirt": 18,
      "source": "https://www.footballsquads.co.uk/eng/2026-2027/fltwo/portv.htm · current 2026/27 roster · #18 · Midfielder"
    },
    {
      "footballName": "Modou Faal",
      "group": "Forward",
      "nationality": "The Gambia",
      "shirt": 9,
      "source": "https://www.footballsquads.co.uk/eng/2026-2027/fltwo/portv.htm · current 2026/27 roster · #9 · Forward"
    },
    {
      "footballName": "Oliver Lynch",
      "group": "Forward",
      "nationality": "England",
      "shirt": 14,
      "source": "https://www.footballsquads.co.uk/eng/2026-2027/fltwo/portv.htm · current 2026/27 roster · #14 · Forward"
    },
    {
      "footballName": "Tyreece Simpson",
      "group": "Forward",
      "nationality": "Saint Kitts and Nevis",
      "shirt": 17,
      "source": "https://www.footballsquads.co.uk/eng/2026-2027/fltwo/portv.htm · current 2026/27 roster · #17 · Forward"
    },
    {
      "footballName": "Ben Waine",
      "group": "Forward",
      "nationality": "New Zealand",
      "shirt": 19,
      "source": "https://www.footballsquads.co.uk/eng/2026-2027/fltwo/portv.htm · current 2026/27 roster · #19 · Forward"
    }
  ]
}
