{
  "schemaVersion": 1,
  "season": "2026/27",
  "clubId": "crewe-alexandra",
  "snapshot": "2026-09-15",
  "sourceSummary": "Crewe Alexandra current 2026/27 first-team roster, shirt number, nationality and broad playing role from FootballSquads after the summer window. The selected 16 use a balanced mix of 2 goalkeepers, 5 defenders, 5 midfielders and 4 forwards.",
  "players": [
    {
      "footballName": "Tom Booth",
      "group": "Goalkeeper",
      "nationality": "England",
      "shirt": 1,
      "source": "https://www.footballsquads.co.uk/eng/2026-2027/fltwo/crewe.htm · current 2026/27 roster · #1 · Goalkeeper"
    },
    {
      "footballName": "Ian Lawlor",
      "group": "Goalkeeper",
      "nationality": "Republic of Ireland",
      "shirt": 13,
      "source": "https://www.footballsquads.co.uk/eng/2026-2027/fltwo/crewe.htm · current 2026/27 roster · #13 · Goalkeeper"
    },
    {
      "footballName": "Lewis Billington",
      "group": "Defender",
      "nationality": "England",
      "shirt": 2,
      "source": "https://www.footballsquads.co.uk/eng/2026-2027/fltwo/crewe.htm · current 2026/27 roster · #2 · Defender"
    },
    {
      "footballName": "Reece Hutchinson",
      "group": "Defender",
      "nationality": "England",
      "shirt": 3,
      "source": "https://www.footballsquads.co.uk/eng/2026-2027/fltwo/crewe.htm · current 2026/27 roster · #3 · Defender"
    },
    {
      "footballName": "Mickey Demetriou",
      "group": "Defender",
      "nationality": "England",
      "shirt": 5,
      "source": "https://www.footballsquads.co.uk/eng/2026-2027/fltwo/crewe.htm · current 2026/27 roster · #5 · Defender"
    },
    {
      "footballName": "Luke Offord",
      "group": "Defender",
      "nationality": "England",
      "shirt": 6,
      "source": "https://www.footballsquads.co.uk/eng/2026-2027/fltwo/crewe.htm · current 2026/27 roster · #6 · Defender"
    },
    {
      "footballName": "Josh Stephenson",
      "group": "Defender",
      "nationality": "England",
      "shirt": 12,
      "source": "https://www.footballsquads.co.uk/eng/2026-2027/fltwo/crewe.htm · current 2026/27 roster · #12 · Defender"
    },
    {
      "footballName": "Kyle Ure",
      "group": "Midfielder",
      "nationality": "Scotland",
      "shirt": 4,
      "source": "https://www.footballsquads.co.uk/eng/2026-2027/fltwo/crewe.htm · current 2026/27 roster · #4 · Midfielder"
    },
    {
      "footballName": "Conor Thomas",
      "group": "Midfielder",
      "nationality": "England",
      "shirt": 8,
      "source": "https://www.footballsquads.co.uk/eng/2026-2027/fltwo/crewe.htm · current 2026/27 roster · #8 · Midfielder"
    },
    {
      "footballName": "Joe White",
      "group": "Midfielder",
      "nationality": "England",
      "shirt": 10,
      "source": "https://www.footballsquads.co.uk/eng/2026-2027/fltwo/crewe.htm · current 2026/27 roster · #10 · Midfielder"
    },
    {
      "footballName": "Jordan Gibson",
      "group": "Midfielder",
      "nationality": "England",
      "shirt": 14,
      "source": "https://www.footballsquads.co.uk/eng/2026-2027/fltwo/crewe.htm · current 2026/27 roster · #14 · Midfielder"
    },
    {
      "footballName": "Matúš Holíček",
      "group": "Midfielder",
      "nationality": "Slovakia",
      "shirt": 17,
      "source": "https://www.footballsquads.co.uk/eng/2026-2027/fltwo/crewe.htm · current 2026/27 roster · #17 · Midfielder"
    },
    {
      "footballName": "Jack Lankester",
      "group": "Forward",
      "nationality": "England",
      "shirt": 7,
      "source": "https://www.footballsquads.co.uk/eng/2026-2027/fltwo/crewe.htm · current 2026/27 roster · #7 · Forward"
    },
    {
      "footballName": "Josh March",
      "group": "Forward",
      "nationality": "England",
      "shirt": 9,
      "source": "https://www.footballsquads.co.uk/eng/2026-2027/fltwo/crewe.htm · current 2026/27 roster · #9 · Forward"
    },
    {
      "footballName": "Joel Tabiner",
      "group": "Forward",
      "nationality": "England",
      "shirt": 11,
      "source": "https://www.footballsquads.co.uk/eng/2026-2027/fltwo/crewe.htm · current 2026/27 roster · #11 · Forward"
    },
    {
      "footballName": "Fin Roberts",
      "group": "Forward",
      "nationality": "England",
      "shirt": 21,
      "source": "https://www.footballsquads.co.uk/eng/2026-2027/fltwo/crewe.htm · current 2026/27 roster · #21 · Forward"
    }
  ]
}
