{
  "schemaVersion": 1,
  "season": "2026/27",
  "clubId": "bristol-rovers",
  "snapshot": "2026-09-15",
  "sourceSummary": "Bristol Rovers current 2026/27 first-team roster, shirt number, nationality and broad playing role from FootballSquads after the summer window. The selected 16 use a balanced mix of 2 goalkeepers, 5 defenders, 5 midfielders and 4 forwards.",
  "players": [
    {
      "footballName": "Brad Young",
      "group": "Goalkeeper",
      "nationality": "England",
      "shirt": 1,
      "source": "https://www.footballsquads.co.uk/eng/2026-2027/fltwo/bristolr.htm · current 2026/27 roster · #1 · Goalkeeper"
    },
    {
      "footballName": "Charlie Binns",
      "group": "Goalkeeper",
      "nationality": "England",
      "shirt": 32,
      "source": "https://www.footballsquads.co.uk/eng/2026-2027/fltwo/bristolr.htm · current 2026/27 roster · #32 · Goalkeeper"
    },
    {
      "footballName": "Tom James",
      "group": "Defender",
      "nationality": "Wales",
      "shirt": 2,
      "source": "https://www.footballsquads.co.uk/eng/2026-2027/fltwo/bristolr.htm · current 2026/27 roster · #2 · Defender"
    },
    {
      "footballName": "Jack Sparkes",
      "group": "Defender",
      "nationality": "England",
      "shirt": 3,
      "source": "https://www.footballsquads.co.uk/eng/2026-2027/fltwo/bristolr.htm · current 2026/27 roster · #3 · Defender"
    },
    {
      "footballName": "Kofi Balmer",
      "group": "Defender",
      "nationality": "Northern Ireland",
      "shirt": 4,
      "source": "https://www.footballsquads.co.uk/eng/2026-2027/fltwo/bristolr.htm · current 2026/27 roster · #4 · Defender"
    },
    {
      "footballName": "Alfie Kilgour",
      "group": "Defender",
      "nationality": "England",
      "shirt": 5,
      "source": "https://www.footballsquads.co.uk/eng/2026-2027/fltwo/bristolr.htm · current 2026/27 roster · #5 · Defender"
    },
    {
      "footballName": "Clinton Mola",
      "group": "Defender",
      "nationality": "England",
      "shirt": 6,
      "source": "https://www.footballsquads.co.uk/eng/2026-2027/fltwo/bristolr.htm · current 2026/27 roster · #6 · Defender"
    },
    {
      "footballName": "Reiss-Alexander Russell-Denny",
      "group": "Midfielder",
      "nationality": "England",
      "shirt": 8,
      "source": "https://www.footballsquads.co.uk/eng/2026-2027/fltwo/bristolr.htm · current 2026/27 roster · #8 · Midfielder"
    },
    {
      "footballName": "Jack Aitchison",
      "group": "Midfielder",
      "nationality": "Scotland",
      "shirt": 11,
      "source": "https://www.footballsquads.co.uk/eng/2026-2027/fltwo/bristolr.htm · current 2026/27 roster · #11 · Midfielder"
    },
    {
      "footballName": "Richard Smallwood",
      "group": "Midfielder",
      "nationality": "England",
      "shirt": 21,
      "source": "https://www.footballsquads.co.uk/eng/2026-2027/fltwo/bristolr.htm · current 2026/27 roster · #21 · Midfielder"
    },
    {
      "footballName": "Tommy Leigh",
      "group": "Midfielder",
      "nationality": "England",
      "shirt": 24,
      "source": "https://www.footballsquads.co.uk/eng/2026-2027/fltwo/bristolr.htm · current 2026/27 roster · #24 · Midfielder"
    },
    {
      "footballName": "Phil Sanyaolu",
      "group": "Midfielder",
      "nationality": "England",
      "shirt": 27,
      "source": "https://www.footballsquads.co.uk/eng/2026-2027/fltwo/bristolr.htm · current 2026/27 roster · #27 · Midfielder"
    },
    {
      "footballName": "Shaq Forde",
      "group": "Forward",
      "nationality": "England",
      "shirt": 7,
      "source": "https://www.footballsquads.co.uk/eng/2026-2027/fltwo/bristolr.htm · current 2026/27 roster · #7 · Forward"
    },
    {
      "footballName": "Joe Quigley",
      "group": "Forward",
      "nationality": "Republic of Ireland",
      "shirt": 9,
      "source": "https://www.footballsquads.co.uk/eng/2026-2027/fltwo/bristolr.htm · current 2026/27 roster · #9 · Forward"
    },
    {
      "footballName": "Bobby Kamwa",
      "group": "Forward",
      "nationality": "Cameroon",
      "shirt": 10,
      "source": "https://www.footballsquads.co.uk/eng/2026-2027/fltwo/bristolr.htm · current 2026/27 roster · #10 · Forward"
    },
    {
      "footballName": "Mees Rijks",
      "group": "Forward",
      "nationality": "Netherlands",
      "shirt": 18,
      "source": "https://www.footballsquads.co.uk/eng/2026-2027/fltwo/bristolr.htm · current 2026/27 roster · #18 · Forward"
    }
  ]
}
