{
  "schemaVersion": 1,
  "season": "2026/27",
  "clubId": "gillingham",
  "snapshot": "2026-09-15",
  "sourceSummary": "Gillingham current 2026/27 first-team roster, shirt number, nationality and broad playing role from FootballSquads after the summer window. The selected 16 use a balanced mix of 2 goalkeepers, 5 defenders, 5 midfielders and 4 forwards.",
  "players": [
    {
      "footballName": "Oliver Wright",
      "group": "Goalkeeper",
      "nationality": "England",
      "shirt": 1,
      "source": "https://www.footballsquads.co.uk/eng/2026-2027/fltwo/gilling.htm · current 2026/27 roster · #1 · Goalkeeper"
    },
    {
      "footballName": "Taite Holtam",
      "group": "Goalkeeper",
      "nationality": "England",
      "shirt": 13,
      "source": "https://www.footballsquads.co.uk/eng/2026-2027/fltwo/gilling.htm · current 2026/27 roster · #13 · Goalkeeper"
    },
    {
      "footballName": "Sam Tabares",
      "group": "Defender",
      "nationality": "England",
      "shirt": 2,
      "source": "https://www.footballsquads.co.uk/eng/2026-2027/fltwo/gilling.htm · current 2026/27 roster · #2 · Defender"
    },
    {
      "footballName": "Conor McManus",
      "group": "Defender",
      "nationality": "Republic of Ireland",
      "shirt": 3,
      "source": "https://www.footballsquads.co.uk/eng/2026-2027/fltwo/gilling.htm · current 2026/27 roster · #3 · Defender"
    },
    {
      "footballName": "Liam Gordon",
      "group": "Defender",
      "nationality": "Scotland",
      "shirt": 4,
      "source": "https://www.footballsquads.co.uk/eng/2026-2027/fltwo/gilling.htm · current 2026/27 roster · #4 · Defender"
    },
    {
      "footballName": "Andy Smith",
      "group": "Defender",
      "nationality": "England",
      "shirt": 5,
      "source": "https://www.footballsquads.co.uk/eng/2026-2027/fltwo/gilling.htm · current 2026/27 roster · #5 · Defender"
    },
    {
      "footballName": "Robbie McKenzie",
      "group": "Defender",
      "nationality": "England",
      "shirt": 14,
      "source": "https://www.footballsquads.co.uk/eng/2026-2027/fltwo/gilling.htm · current 2026/27 roster · #14 · Defender"
    },
    {
      "footballName": "Ethan Coleman",
      "group": "Midfielder",
      "nationality": "England",
      "shirt": 6,
      "source": "https://www.footballsquads.co.uk/eng/2026-2027/fltwo/gilling.htm · current 2026/27 roster · #6 · Midfielder"
    },
    {
      "footballName": "Kadeem Harris",
      "group": "Midfielder",
      "nationality": "England",
      "shirt": 7,
      "source": "https://www.footballsquads.co.uk/eng/2026-2027/fltwo/gilling.htm · current 2026/27 roster · #7 · Midfielder"
    },
    {
      "footballName": "Armani Little",
      "group": "Midfielder",
      "nationality": "England",
      "shirt": 8,
      "source": "https://www.footballsquads.co.uk/eng/2026-2027/fltwo/gilling.htm · current 2026/27 roster · #8 · Midfielder"
    },
    {
      "footballName": "Garath McCleary",
      "group": "Midfielder",
      "nationality": "Jamaica",
      "shirt": 12,
      "source": "https://www.footballsquads.co.uk/eng/2026-2027/fltwo/gilling.htm · current 2026/27 roster · #12 · Midfielder"
    },
    {
      "footballName": "Zane Albarus",
      "group": "Midfielder",
      "nationality": "England",
      "shirt": 15,
      "source": "https://www.footballsquads.co.uk/eng/2026-2027/fltwo/gilling.htm · current 2026/27 roster · #15 · Midfielder"
    },
    {
      "footballName": "Will Goodwin",
      "group": "Forward",
      "nationality": "England",
      "shirt": 9,
      "source": "https://www.footballsquads.co.uk/eng/2026-2027/fltwo/gilling.htm · current 2026/27 roster · #9 · Forward"
    },
    {
      "footballName": "Ronan Hale",
      "group": "Forward",
      "nationality": "Northern Ireland",
      "shirt": 10,
      "source": "https://www.footballsquads.co.uk/eng/2026-2027/fltwo/gilling.htm · current 2026/27 roster · #10 · Forward"
    },
    {
      "footballName": "Lamin Sillah",
      "group": "Forward",
      "nationality": "The Gambia",
      "shirt": 11,
      "source": "https://www.footballsquads.co.uk/eng/2026-2027/fltwo/gilling.htm · current 2026/27 roster · #11 · Forward"
    },
    {
      "footballName": "Sheldon Kendall",
      "group": "Forward",
      "nationality": "Guyana",
      "shirt": 18,
      "source": "https://www.footballsquads.co.uk/eng/2026-2027/fltwo/gilling.htm · current 2026/27 roster · #18 · Forward"
    }
  ]
}
