{
  "schemaVersion": 1,
  "season": "2026/27",
  "clubId": "colchester-united",
  "snapshot": "2026-09-15",
  "sourceSummary": "Colchester United current 2026/27 first-team roster, shirt number, nationality and broad playing role from FootballSquads after the summer window. The selected 16 use a balanced mix of 2 goalkeepers, 5 defenders, 5 midfielders and 4 forwards.",
  "players": [
    {
      "footballName": "Tom Smith",
      "group": "Goalkeeper",
      "nationality": "England",
      "shirt": 1,
      "source": "https://www.footballsquads.co.uk/eng/2026-2027/fltwo/colches.htm · current 2026/27 roster · #1 · Goalkeeper"
    },
    {
      "footballName": "Thimothee Lo-Tutala",
      "group": "Goalkeeper",
      "nationality": "France",
      "shirt": 22,
      "source": "https://www.footballsquads.co.uk/eng/2026-2027/fltwo/colches.htm · current 2026/27 roster · #22 · Goalkeeper"
    },
    {
      "footballName": "Rob Hunt",
      "group": "Defender",
      "nationality": "England",
      "shirt": 2,
      "source": "https://www.footballsquads.co.uk/eng/2026-2027/fltwo/colches.htm · current 2026/27 roster · #2 · Defender"
    },
    {
      "footballName": "Ellis Iandolo",
      "group": "Defender",
      "nationality": "England",
      "shirt": 3,
      "source": "https://www.footballsquads.co.uk/eng/2026-2027/fltwo/colches.htm · current 2026/27 roster · #3 · Defender"
    },
    {
      "footballName": "Jack Tucker",
      "group": "Defender",
      "nationality": "England",
      "shirt": 5,
      "source": "https://www.footballsquads.co.uk/eng/2026-2027/fltwo/colches.htm · current 2026/27 roster · #5 · Defender"
    },
    {
      "footballName": "Sean Raggett",
      "group": "Defender",
      "nationality": "England",
      "shirt": 20,
      "source": "https://www.footballsquads.co.uk/eng/2026-2027/fltwo/colches.htm · current 2026/27 roster · #20 · Defender"
    },
    {
      "footballName": "Jake Leake",
      "group": "Defender",
      "nationality": "England",
      "shirt": 21,
      "source": "https://www.footballsquads.co.uk/eng/2026-2027/fltwo/colches.htm · current 2026/27 roster · #21 · Defender"
    },
    {
      "footballName": "Ben Perry",
      "group": "Midfielder",
      "nationality": "England",
      "shirt": 4,
      "source": "https://www.footballsquads.co.uk/eng/2026-2027/fltwo/colches.htm · current 2026/27 roster · #4 · Midfielder"
    },
    {
      "footballName": "Paul Digby",
      "group": "Midfielder",
      "nationality": "England",
      "shirt": 6,
      "source": "https://www.footballsquads.co.uk/eng/2026-2027/fltwo/colches.htm · current 2026/27 roster · #6 · Midfielder"
    },
    {
      "footballName": "Harry Anderson",
      "group": "Midfielder",
      "nationality": "England",
      "shirt": 7,
      "source": "https://www.footballsquads.co.uk/eng/2026-2027/fltwo/colches.htm · current 2026/27 roster · #7 · Midfielder"
    },
    {
      "footballName": "Teddy Bishop",
      "group": "Midfielder",
      "nationality": "England",
      "shirt": 8,
      "source": "https://www.footballsquads.co.uk/eng/2026-2027/fltwo/colches.htm · current 2026/27 roster · #8 · Midfielder"
    },
    {
      "footballName": "Jack Payne",
      "group": "Midfielder",
      "nationality": "England",
      "shirt": 10,
      "source": "https://www.footballsquads.co.uk/eng/2026-2027/fltwo/colches.htm · current 2026/27 roster · #10 · Midfielder"
    },
    {
      "footballName": "Bradley Ihionvien",
      "group": "Forward",
      "nationality": "England",
      "shirt": 9,
      "source": "https://www.footballsquads.co.uk/eng/2026-2027/fltwo/colches.htm · current 2026/27 roster · #9 · Forward"
    },
    {
      "footballName": "Leon Chiwome",
      "group": "Forward",
      "nationality": "England",
      "shirt": 11,
      "source": "https://www.footballsquads.co.uk/eng/2026-2027/fltwo/colches.htm · current 2026/27 roster · #11 · Forward"
    },
    {
      "footballName": "Kylian Kouassi",
      "group": "Forward",
      "nationality": "England",
      "shirt": 14,
      "source": "https://www.footballsquads.co.uk/eng/2026-2027/fltwo/colches.htm · current 2026/27 roster · #14 · Forward"
    },
    {
      "footballName": "Jaden Williams",
      "group": "Forward",
      "nationality": "England",
      "shirt": 17,
      "source": "https://www.footballsquads.co.uk/eng/2026-2027/fltwo/colches.htm · current 2026/27 roster · #17 · Forward"
    }
  ]
}
