{
  "schemaVersion": 1,
  "season": "2026/27",
  "clubId": "tranmere-rovers",
  "snapshot": "2026-09-15",
  "sourceSummary": "Tranmere Rovers current 2026/27 first-team roster, shirt number, nationality and broad playing role from FootballSquads after the summer window. The selected 16 use a balanced mix of 2 goalkeepers, 5 defenders, 5 midfielders and 4 forwards.",
  "players": [
    {
      "footballName": "Luke McGee",
      "group": "Goalkeeper",
      "nationality": "England",
      "shirt": 1,
      "source": "https://www.footballsquads.co.uk/eng/2026-2027/fltwo/tranmere.htm · current 2026/27 roster · #1 · Goalkeeper"
    },
    {
      "footballName": "Harrison Male",
      "group": "Goalkeeper",
      "nationality": "England",
      "shirt": 12,
      "source": "https://www.footballsquads.co.uk/eng/2026-2027/fltwo/tranmere.htm · current 2026/27 roster · #12 · Goalkeeper"
    },
    {
      "footballName": "Joel Senior",
      "group": "Defender",
      "nationality": "England",
      "shirt": 2,
      "source": "https://www.footballsquads.co.uk/eng/2026-2027/fltwo/tranmere.htm · current 2026/27 roster · #2 · Defender"
    },
    {
      "footballName": "Jacob Slater",
      "group": "Defender",
      "nationality": "Republic of Ireland",
      "shirt": 3,
      "source": "https://www.footballsquads.co.uk/eng/2026-2027/fltwo/tranmere.htm · current 2026/27 roster · #3 · Defender"
    },
    {
      "footballName": "Jordan Turnbull",
      "group": "Defender",
      "nationality": "England",
      "shirt": 4,
      "source": "https://www.footballsquads.co.uk/eng/2026-2027/fltwo/tranmere.htm · current 2026/27 roster · #4 · Defender"
    },
    {
      "footballName": "Nathan Smith",
      "group": "Defender",
      "nationality": "England",
      "shirt": 5,
      "source": "https://www.footballsquads.co.uk/eng/2026-2027/fltwo/tranmere.htm · current 2026/27 roster · #5 · Defender"
    },
    {
      "footballName": "Will Vaulks",
      "group": "Defender",
      "nationality": "Wales",
      "shirt": 6,
      "source": "https://www.footballsquads.co.uk/eng/2026-2027/fltwo/tranmere.htm · current 2026/27 roster · #6 · Defender"
    },
    {
      "footballName": "Charlie Whitaker",
      "group": "Midfielder",
      "nationality": "England",
      "shirt": 7,
      "source": "https://www.footballsquads.co.uk/eng/2026-2027/fltwo/tranmere.htm · current 2026/27 roster · #7 · Midfielder"
    },
    {
      "footballName": "Sam Finley",
      "group": "Midfielder",
      "nationality": "England",
      "shirt": 8,
      "source": "https://www.footballsquads.co.uk/eng/2026-2027/fltwo/tranmere.htm · current 2026/27 roster · #8 · Midfielder"
    },
    {
      "footballName": "Thomas Ince",
      "group": "Midfielder",
      "nationality": "England",
      "shirt": 10,
      "source": "https://www.footballsquads.co.uk/eng/2026-2027/fltwo/tranmere.htm · current 2026/27 roster · #10 · Midfielder"
    },
    {
      "footballName": "Tom Conlon",
      "group": "Midfielder",
      "nationality": "England",
      "shirt": 11,
      "source": "https://www.footballsquads.co.uk/eng/2026-2027/fltwo/tranmere.htm · current 2026/27 roster · #11 · Midfielder"
    },
    {
      "footballName": "Jordan Davies",
      "group": "Midfielder",
      "nationality": "Wales",
      "shirt": 15,
      "source": "https://www.footballsquads.co.uk/eng/2026-2027/fltwo/tranmere.htm · current 2026/27 roster · #15 · Midfielder"
    },
    {
      "footballName": "Joe Ironside",
      "group": "Forward",
      "nationality": "England",
      "shirt": 9,
      "source": "https://www.footballsquads.co.uk/eng/2026-2027/fltwo/tranmere.htm · current 2026/27 roster · #9 · Forward"
    },
    {
      "footballName": "Zane Okoro",
      "group": "Forward",
      "nationality": "United States",
      "shirt": 17,
      "source": "https://www.footballsquads.co.uk/eng/2026-2027/fltwo/tranmere.htm · current 2026/27 roster · #17 · Forward"
    },
    {
      "footballName": "Connor Jennings",
      "group": "Forward",
      "nationality": "England",
      "shirt": 18,
      "source": "https://www.footballsquads.co.uk/eng/2026-2027/fltwo/tranmere.htm · current 2026/27 roster · #18 · Forward"
    },
    {
      "footballName": "Courtney Baker-Richardson",
      "group": "Forward",
      "nationality": "England",
      "shirt": 19,
      "source": "https://www.footballsquads.co.uk/eng/2026-2027/fltwo/tranmere.htm · current 2026/27 roster · #19 · Forward"
    }
  ]
}
