{
  "schemaVersion": 1,
  "season": "2026/27",
  "clubId": "cheltenham-town",
  "snapshot": "2026-09-15",
  "sourceSummary": "Cheltenham Town current 2026/27 first-team roster, shirt number, nationality and broad playing role from FootballSquads after the summer window. The selected 16 use a balanced mix of 2 goalkeepers, 5 defenders, 5 midfielders and 4 forwards.",
  "players": [
    {
      "footballName": "Joe Day",
      "group": "Goalkeeper",
      "nationality": "England",
      "shirt": 1,
      "source": "https://www.footballsquads.co.uk/eng/2026-2027/fltwo/chelt.htm · current 2026/27 roster · #1 · Goalkeeper"
    },
    {
      "footballName": "Wyll Stanway",
      "group": "Goalkeeper",
      "nationality": "England",
      "shirt": 23,
      "source": "https://www.footballsquads.co.uk/eng/2026-2027/fltwo/chelt.htm · current 2026/27 roster · #23 · Goalkeeper"
    },
    {
      "footballName": "Jonathan Tomkinson",
      "group": "Defender",
      "nationality": "United States",
      "shirt": 3,
      "source": "https://www.footballsquads.co.uk/eng/2026-2027/fltwo/chelt.htm · current 2026/27 roster · #3 · Defender"
    },
    {
      "footballName": "Joe Tomlinson",
      "group": "Defender",
      "nationality": "England",
      "shirt": 4,
      "source": "https://www.footballsquads.co.uk/eng/2026-2027/fltwo/chelt.htm · current 2026/27 roster · #4 · Defender"
    },
    {
      "footballName": "Robbie Cundy",
      "group": "Defender",
      "nationality": "England",
      "shirt": 5,
      "source": "https://www.footballsquads.co.uk/eng/2026-2027/fltwo/chelt.htm · current 2026/27 roster · #5 · Defender"
    },
    {
      "footballName": "James Wilson",
      "group": "Defender",
      "nationality": "Wales",
      "shirt": 6,
      "source": "https://www.footballsquads.co.uk/eng/2026-2027/fltwo/chelt.htm · current 2026/27 roster · #6 · Defender"
    },
    {
      "footballName": "George Nurse",
      "group": "Defender",
      "nationality": "England",
      "shirt": 21,
      "source": "https://www.footballsquads.co.uk/eng/2026-2027/fltwo/chelt.htm · current 2026/27 roster · #21 · Defender"
    },
    {
      "footballName": "Ben Stevenson",
      "group": "Midfielder",
      "nationality": "England",
      "shirt": 7,
      "source": "https://www.footballsquads.co.uk/eng/2026-2027/fltwo/chelt.htm · current 2026/27 roster · #7 · Midfielder"
    },
    {
      "footballName": "Charlie McCann",
      "group": "Midfielder",
      "nationality": "Northern Ireland",
      "shirt": 8,
      "source": "https://www.footballsquads.co.uk/eng/2026-2027/fltwo/chelt.htm · current 2026/27 roster · #8 · Midfielder"
    },
    {
      "footballName": "Ryan Broom",
      "group": "Midfielder",
      "nationality": "Wales",
      "shirt": 14,
      "source": "https://www.footballsquads.co.uk/eng/2026-2027/fltwo/chelt.htm · current 2026/27 roster · #14 · Midfielder"
    },
    {
      "footballName": "Shaun McWilliams",
      "group": "Midfielder",
      "nationality": "England",
      "shirt": 17,
      "source": "https://www.footballsquads.co.uk/eng/2026-2027/fltwo/chelt.htm · current 2026/27 roster · #17 · Midfielder"
    },
    {
      "footballName": "Jordan Shipley",
      "group": "Midfielder",
      "nationality": "Republic of Ireland",
      "shirt": 26,
      "source": "https://www.footballsquads.co.uk/eng/2026-2027/fltwo/chelt.htm · current 2026/27 roster · #26 · Midfielder"
    },
    {
      "footballName": "Kirsten Otchere",
      "group": "Forward",
      "nationality": "England",
      "shirt": 9,
      "source": "https://www.footballsquads.co.uk/eng/2026-2027/fltwo/chelt.htm · current 2026/27 roster · #9 · Forward"
    },
    {
      "footballName": "George Miller",
      "group": "Forward",
      "nationality": "England",
      "shirt": 10,
      "source": "https://www.footballsquads.co.uk/eng/2026-2027/fltwo/chelt.htm · current 2026/27 roster · #10 · Forward"
    },
    {
      "footballName": "Jake Bickerstaff",
      "group": "Forward",
      "nationality": "Wales",
      "shirt": 11,
      "source": "https://www.footballsquads.co.uk/eng/2026-2027/fltwo/chelt.htm · current 2026/27 roster · #11 · Forward"
    },
    {
      "footballName": "Andreas Weimann",
      "group": "Forward",
      "nationality": "Austria",
      "shirt": 18,
      "source": "https://www.footballsquads.co.uk/eng/2026-2027/fltwo/chelt.htm · current 2026/27 roster · #18 · Forward"
    }
  ]
}
