{
  "schemaVersion": 1,
  "season": "2026/27",
  "clubId": "barnet",
  "snapshot": "2026-09-15",
  "sourceSummary": "Barnet current 2026/27 first-team roster, shirt number, nationality and broad playing role from FootballSquads after the summer window. The selected 16 use a balanced mix of 2 goalkeepers, 5 defenders, 5 midfielders and 4 forwards.",
  "players": [
    {
      "footballName": "Taye Ashby-Hammond",
      "group": "Goalkeeper",
      "nationality": "England",
      "shirt": 1,
      "source": "https://www.footballsquads.co.uk/eng/2026-2027/fltwo/barnet.htm · current 2026/27 roster · #1 · Goalkeeper"
    },
    {
      "footballName": "Matthew Cox",
      "group": "Goalkeeper",
      "nationality": "England",
      "shirt": 13,
      "source": "https://www.footballsquads.co.uk/eng/2026-2027/fltwo/barnet.htm · current 2026/27 roster · #13 · Goalkeeper"
    },
    {
      "footballName": "Romoney Crichlow-Noble",
      "group": "Defender",
      "nationality": "England",
      "shirt": 3,
      "source": "https://www.footballsquads.co.uk/eng/2026-2027/fltwo/barnet.htm · current 2026/27 roster · #3 · Defender"
    },
    {
      "footballName": "Daniele Collinge",
      "group": "Defender",
      "nationality": "England",
      "shirt": 4,
      "source": "https://www.footballsquads.co.uk/eng/2026-2027/fltwo/barnet.htm · current 2026/27 roster · #4 · Defender"
    },
    {
      "footballName": "Adam Senior",
      "group": "Defender",
      "nationality": "England",
      "shirt": 5,
      "source": "https://www.footballsquads.co.uk/eng/2026-2027/fltwo/barnet.htm · current 2026/27 roster · #5 · Defender"
    },
    {
      "footballName": "Zac Williams",
      "group": "Defender",
      "nationality": "Wales",
      "shirt": 6,
      "source": "https://www.footballsquads.co.uk/eng/2026-2027/fltwo/barnet.htm · current 2026/27 roster · #6 · Defender"
    },
    {
      "footballName": "Will Wright",
      "group": "Defender",
      "nationality": "England",
      "shirt": 12,
      "source": "https://www.footballsquads.co.uk/eng/2026-2027/fltwo/barnet.htm · current 2026/27 roster · #12 · Defender"
    },
    {
      "footballName": "Charlie Lakin",
      "group": "Midfielder",
      "nationality": "England",
      "shirt": 8,
      "source": "https://www.footballsquads.co.uk/eng/2026-2027/fltwo/barnet.htm · current 2026/27 roster · #8 · Midfielder"
    },
    {
      "footballName": "Nnamdi Ofoborh",
      "group": "Midfielder",
      "nationality": "Nigeria",
      "shirt": 10,
      "source": "https://www.footballsquads.co.uk/eng/2026-2027/fltwo/barnet.htm · current 2026/27 roster · #10 · Midfielder"
    },
    {
      "footballName": "Idris Kanu",
      "group": "Midfielder",
      "nationality": "Sierra Leone",
      "shirt": 11,
      "source": "https://www.footballsquads.co.uk/eng/2026-2027/fltwo/barnet.htm · current 2026/27 roster · #11 · Midfielder"
    },
    {
      "footballName": "Brandon Comley",
      "group": "Midfielder",
      "nationality": "Montserrat",
      "shirt": 14,
      "source": "https://www.footballsquads.co.uk/eng/2026-2027/fltwo/barnet.htm · current 2026/27 roster · #14 · Midfielder"
    },
    {
      "footballName": "Kane Smith",
      "group": "Midfielder",
      "nationality": "England",
      "shirt": 18,
      "source": "https://www.footballsquads.co.uk/eng/2026-2027/fltwo/barnet.htm · current 2026/27 roster · #18 · Midfielder"
    },
    {
      "footballName": "Tom Knowles",
      "group": "Forward",
      "nationality": "England",
      "shirt": 7,
      "source": "https://www.footballsquads.co.uk/eng/2026-2027/fltwo/barnet.htm · current 2026/27 roster · #7 · Forward"
    },
    {
      "footballName": "Jack Maskell",
      "group": "Forward",
      "nationality": "England",
      "shirt": 9,
      "source": "https://www.footballsquads.co.uk/eng/2026-2027/fltwo/barnet.htm · current 2026/27 roster · #9 · Forward"
    },
    {
      "footballName": "Damola Ajayi",
      "group": "Forward",
      "nationality": "England",
      "shirt": 17,
      "source": "https://www.footballsquads.co.uk/eng/2026-2027/fltwo/barnet.htm · current 2026/27 roster · #17 · Forward"
    },
    {
      "footballName": "Kabongo Tshimanga",
      "group": "Forward",
      "nationality": "England",
      "shirt": 20,
      "source": "https://www.footballsquads.co.uk/eng/2026-2027/fltwo/barnet.htm · current 2026/27 roster · #20 · Forward"
    }
  ]
}
