{
  "schemaVersion": 1,
  "season": "2026/27",
  "clubId": "chesterfield",
  "snapshot": "2026-09-15",
  "sourceSummary": "Chesterfield current 2026/27 first-team roster, shirt number, nationality and broad playing role from FootballSquads after the summer window. The selected 16 use a balanced mix of 2 goalkeepers, 5 defenders, 5 midfielders and 4 forwards.",
  "players": [
    {
      "footballName": "Zach Hemming",
      "group": "Goalkeeper",
      "nationality": "England",
      "shirt": 1,
      "source": "https://www.footballsquads.co.uk/eng/2026-2027/fltwo/chestrf.htm · current 2026/27 roster · #1 · Goalkeeper"
    },
    {
      "footballName": "Ryan Boot",
      "group": "Goalkeeper",
      "nationality": "England",
      "shirt": 23,
      "source": "https://www.footballsquads.co.uk/eng/2026-2027/fltwo/chestrf.htm · current 2026/27 roster · #23 · Goalkeeper"
    },
    {
      "footballName": "Malik Owolabi-Belewu",
      "group": "Defender",
      "nationality": "Canada",
      "shirt": 2,
      "source": "https://www.footballsquads.co.uk/eng/2026-2027/fltwo/chestrf.htm · current 2026/27 roster · #2 · Defender"
    },
    {
      "footballName": "Kyle McFadzean",
      "group": "Defender",
      "nationality": "England",
      "shirt": 5,
      "source": "https://www.footballsquads.co.uk/eng/2026-2027/fltwo/chestrf.htm · current 2026/27 roster · #5 · Defender"
    },
    {
      "footballName": "Jack Simpson",
      "group": "Defender",
      "nationality": "England",
      "shirt": 6,
      "source": "https://www.footballsquads.co.uk/eng/2026-2027/fltwo/chestrf.htm · current 2026/27 roster · #6 · Defender"
    },
    {
      "footballName": "Alfie Pond",
      "group": "Defender",
      "nationality": "England",
      "shirt": 15,
      "source": "https://www.footballsquads.co.uk/eng/2026-2027/fltwo/chestrf.htm · current 2026/27 roster · #15 · Defender"
    },
    {
      "footballName": "Lewis Gordon",
      "group": "Defender",
      "nationality": "Scotland",
      "shirt": 19,
      "source": "https://www.footballsquads.co.uk/eng/2026-2027/fltwo/chestrf.htm · current 2026/27 roster · #19 · Defender"
    },
    {
      "footballName": "Tom Naylor",
      "group": "Midfielder",
      "nationality": "England",
      "shirt": 4,
      "source": "https://www.footballsquads.co.uk/eng/2026-2027/fltwo/chestrf.htm · current 2026/27 roster · #4 · Midfielder"
    },
    {
      "footballName": "Ryan Stirk",
      "group": "Midfielder",
      "nationality": "Wales",
      "shirt": 8,
      "source": "https://www.footballsquads.co.uk/eng/2026-2027/fltwo/chestrf.htm · current 2026/27 roster · #8 · Midfielder"
    },
    {
      "footballName": "Dylan Duffy",
      "group": "Midfielder",
      "nationality": "Republic of Ireland",
      "shirt": 11,
      "source": "https://www.footballsquads.co.uk/eng/2026-2027/fltwo/chestrf.htm · current 2026/27 roster · #11 · Midfielder"
    },
    {
      "footballName": "George McEachran",
      "group": "Midfielder",
      "nationality": "England",
      "shirt": 20,
      "source": "https://www.footballsquads.co.uk/eng/2026-2027/fltwo/chestrf.htm · current 2026/27 roster · #20 · Midfielder"
    },
    {
      "footballName": "Kiano Dyer",
      "group": "Midfielder",
      "nationality": "England",
      "shirt": 27,
      "source": "https://www.footballsquads.co.uk/eng/2026-2027/fltwo/chestrf.htm · current 2026/27 roster · #27 · Midfielder"
    },
    {
      "footballName": "Liam Mandeville",
      "group": "Forward",
      "nationality": "England",
      "shirt": 7,
      "source": "https://www.footballsquads.co.uk/eng/2026-2027/fltwo/chestrf.htm · current 2026/27 roster · #7 · Forward"
    },
    {
      "footballName": "Fraser Bryden",
      "group": "Forward",
      "nationality": "Scotland",
      "shirt": 9,
      "source": "https://www.footballsquads.co.uk/eng/2026-2027/fltwo/chestrf.htm · current 2026/27 roster · #9 · Forward"
    },
    {
      "footballName": "Lee Bonis",
      "group": "Forward",
      "nationality": "Northern Ireland",
      "shirt": 10,
      "source": "https://www.footballsquads.co.uk/eng/2026-2027/fltwo/chestrf.htm · current 2026/27 roster · #10 · Forward"
    },
    {
      "footballName": "Ruel Sotiriou",
      "group": "Forward",
      "nationality": "Cyprus",
      "shirt": 17,
      "source": "https://www.footballsquads.co.uk/eng/2026-2027/fltwo/chestrf.htm · current 2026/27 roster · #17 · Forward"
    }
  ]
}
