{
  "schemaVersion": 1,
  "season": "2026/27",
  "clubId": "salford-city",
  "snapshot": "2026-09-15",
  "sourceSummary": "Salford City current 2026/27 first-team roster, shirt number, nationality and broad playing role from FootballSquads after the summer window. The selected 16 use a balanced mix of 2 goalkeepers, 5 defenders, 5 midfielders and 4 forwards.",
  "players": [
    {
      "footballName": "Will Norris",
      "group": "Goalkeeper",
      "nationality": "England",
      "shirt": 1,
      "source": "https://www.footballsquads.co.uk/eng/2026-2027/fltwo/salford.htm · current 2026/27 roster · #1 · Goalkeeper"
    },
    {
      "footballName": "Sam Long",
      "group": "Goalkeeper",
      "nationality": "England",
      "shirt": 12,
      "source": "https://www.footballsquads.co.uk/eng/2026-2027/fltwo/salford.htm · current 2026/27 roster · #12 · Goalkeeper"
    },
    {
      "footballName": "Nathan Asiimwe",
      "group": "Defender",
      "nationality": "Uganda",
      "shirt": 2,
      "source": "https://www.footballsquads.co.uk/eng/2026-2027/fltwo/salford.htm · current 2026/27 roster · #2 · Defender"
    },
    {
      "footballName": "Zach Awe",
      "group": "Defender",
      "nationality": "England",
      "shirt": 3,
      "source": "https://www.footballsquads.co.uk/eng/2026-2027/fltwo/salford.htm · current 2026/27 roster · #3 · Defender"
    },
    {
      "footballName": "Will Aimson",
      "group": "Defender",
      "nationality": "England",
      "shirt": 4,
      "source": "https://www.footballsquads.co.uk/eng/2026-2027/fltwo/salford.htm · current 2026/27 roster · #4 · Defender"
    },
    {
      "footballName": "Michael Rose",
      "group": "Defender",
      "nationality": "Scotland",
      "shirt": 5,
      "source": "https://www.footballsquads.co.uk/eng/2026-2027/fltwo/salford.htm · current 2026/27 roster · #5 · Defender"
    },
    {
      "footballName": "Brandon Cooper",
      "group": "Defender",
      "nationality": "Wales",
      "shirt": 15,
      "source": "https://www.footballsquads.co.uk/eng/2026-2027/fltwo/salford.htm · current 2026/27 roster · #15 · Defender"
    },
    {
      "footballName": "Joe Powell",
      "group": "Midfielder",
      "nationality": "England",
      "shirt": 6,
      "source": "https://www.footballsquads.co.uk/eng/2026-2027/fltwo/salford.htm · current 2026/27 roster · #6 · Midfielder"
    },
    {
      "footballName": "Ben Woodburn",
      "group": "Midfielder",
      "nationality": "Wales",
      "shirt": 7,
      "source": "https://www.footballsquads.co.uk/eng/2026-2027/fltwo/salford.htm · current 2026/27 roster · #7 · Midfielder"
    },
    {
      "footballName": "Jorge Grant",
      "group": "Midfielder",
      "nationality": "England",
      "shirt": 8,
      "source": "https://www.footballsquads.co.uk/eng/2026-2027/fltwo/salford.htm · current 2026/27 roster · #8 · Midfielder"
    },
    {
      "footballName": "Kelly N'Mai",
      "group": "Midfielder",
      "nationality": "Netherlands",
      "shirt": 10,
      "source": "https://www.footballsquads.co.uk/eng/2026-2027/fltwo/salford.htm · current 2026/27 roster · #10 · Midfielder"
    },
    {
      "footballName": "Elliot Bonds",
      "group": "Midfielder",
      "nationality": "Guyana",
      "shirt": 16,
      "source": "https://www.footballsquads.co.uk/eng/2026-2027/fltwo/salford.htm · current 2026/27 roster · #16 · Midfielder"
    },
    {
      "footballName": "Macaulay Langstaff",
      "group": "Forward",
      "nationality": "England",
      "shirt": 9,
      "source": "https://www.footballsquads.co.uk/eng/2026-2027/fltwo/salford.htm · current 2026/27 roster · #9 · Forward"
    },
    {
      "footballName": "Abraham Odoh",
      "group": "Forward",
      "nationality": "England",
      "shirt": 14,
      "source": "https://www.footballsquads.co.uk/eng/2026-2027/fltwo/salford.htm · current 2026/27 roster · #14 · Forward"
    },
    {
      "footballName": "Ryan Graydon",
      "group": "Forward",
      "nationality": "Republic of Ireland",
      "shirt": 19,
      "source": "https://www.footballsquads.co.uk/eng/2026-2027/fltwo/salford.htm · current 2026/27 roster · #19 · Forward"
    },
    {
      "footballName": "Daniel Udoh",
      "group": "Forward",
      "nationality": "Nigeria",
      "shirt": 23,
      "source": "https://www.footballsquads.co.uk/eng/2026-2027/fltwo/salford.htm · current 2026/27 roster · #23 · Forward"
    }
  ]
}
